{
  "schema_version": 1,
  "created_at_utc": "2026-07-21T00:00:00+00:00",
  "hardware": {
    "schema_version": 1,
    "timestamp_utc": "2026-07-21T00:00:00+00:00",
    "operating_system": "Windows",
    "operating_system_version": "11",
    "cpu_model": "Example CPU",
    "cpu_vendor": "Example Vendor",
    "physical_cores": 8,
    "logical_cores": 16,
    "configured_threads": 16,
    "ram_bytes": 34359738368,
    "compiler": "cl",
    "compiler_version": "19.40",
    "python_version": "3.11.9",
    "pytorch_version": "2.7.1",
    "architecture": "mlgru",
    "model_repo": "ShiningSon/Leviathan-MLGRU-200M-TinyStories-Instruct-v09a",
    "model_revision": "116a857bdaf2a1118d479d52aedba7e65cbff960",
    "engine_commit": "2eb51fa7feb1f9502690fc33fcb9d89474a74644",
    "benchmark_command": "python scripts/benchmark_engine.py --model-dir ./model --modes 0 0.10"
  },
  "model": {
    "identifier": "leviathan_mlgru_200m_instruct_v09a",
    "hf_repo": "ShiningSon/Leviathan-MLGRU-200M-TinyStories-Instruct-v09a",
    "hf_revision": "116a857bdaf2a1118d479d52aedba7e65cbff960",
    "metadata_identifier": "leviathan_mlgru_200m_instruct_v09a"
  },
  "engine_commit": "2eb51fa7feb1f9502690fc33fcb9d89474a74644",
  "prompt_set": {
    "file_name": "fixture_prompts.json",
    "sha256": "cccccccccccccccccccccccccccccccccccccccccccccccccccccccccccccccc",
    "prompt_count": 2
  },
  "benchmark": {
    "architecture": "mlgru",
    "prompt_template": "qa",
    "max_new": 80,
    "warmups": 1,
    "repeats": 2,
    "mode_schedule": "interleave"
  },
  "modes": [
    {
      "mode_id": "0",
      "recommended": false,
      "settings": {
        "top_k": 0.0,
        "sparse_min_density": 0.6,
        "no_top_k_sort": true,
        "top_k_select": "histogram",
        "sparse_scope": "down"
      },
      "latency_ms": {
        "samples": [100.0, 102.0, 98.0, 100.0],
        "mean": 100.0,
        "median": 100.0,
        "standard_deviation": 1.4142135623730951
      },
      "tokens_per_sec": {
        "samples": [10.0, 11.0, 9.0, 10.0],
        "mean": 10.0,
        "median": 10.0,
        "standard_deviation": 0.7071067811865476
      },
      "qa": {
        "numerator": 4,
        "denominator": 4,
        "rate": 1.0
      },
      "output_checksum": "aaaaaaaaaaaaaaaaaaaaaaaaaaaaaaaaaaaaaaaaaaaaaaaaaaaaaaaaaaaaaaaa",
      "process_failures": 0,
      "parse_failures": 0
    },
    {
      "mode_id": "0.10",
      "recommended": true,
      "settings": {
        "top_k": 0.1,
        "sparse_min_density": 0.6,
        "no_top_k_sort": true,
        "top_k_select": "histogram",
        "sparse_scope": "down"
      },
      "latency_ms": {
        "samples": [90.0, 92.0, 88.0, 90.0],
        "mean": 90.0,
        "median": 90.0,
        "standard_deviation": 1.4142135623730951
      },
      "tokens_per_sec": {
        "samples": [11.0, 12.0, 10.0, 11.0],
        "mean": 11.0,
        "median": 11.0,
        "standard_deviation": 0.7071067811865476
      },
      "qa": {
        "numerator": 4,
        "denominator": 4,
        "rate": 1.0
      },
      "output_checksum": "bbbbbbbbbbbbbbbbbbbbbbbbbbbbbbbbbbbbbbbbbbbbbbbbbbbbbbbbbbbbbbbb",
      "process_failures": 0,
      "parse_failures": 0
    }
  ],
  "caveats": [
    "Fixture values validate the portable format and are not benchmark claims."
  ]
}
